{
  "$schema": "./schemas/sessions.schema.json",
  "version": "1.0.0",
  "project": "mekong-cli",
  "_meta": {
    "schemaVersion": "1.0.0",
    "checksum": "",
    "lastModified": "2026-01-24T03:22:47Z",
    "totalSessionsCreated": 0
  },
  "config": {
    "maxConcurrentSessions": 5,
    "maxActiveTasksPerScope": 1,
    "scopeValidation": "strict",
    "allowNestedScopes": true,
    "allowScopeOverlap": false
  },
  "sessions": [],
  "sessionHistory": []
}
